FRR_ID,Family,Title,Primary_Keyword,Impact_Low,Impact_Moderate,Impact_High,Code_Detectable,Statement
FRR-VDR-TF-LO-04,VDR,Six-Month Detection,SHOULD,Yes,No,No,Partial,"Providers SHOULD _persistently_ perform _vulnerability detection_ on all _information resources_ that are NOT _likely_ to _drift_, at least once every six months."
FRR-VDR-TF-LO-05,VDR,Evaluate Within 7 Days,MUST,Yes,No,No,No,"Providers SHOULD evaluate ALL _vulnerabilities_ as required by FRR-VDR-07, FRR-VDR-08, and FRR-VDR-09 within 7 days of _detection_."
FRR-VDR-TF-LO-06,VDR,Mitigate Per Timeframes,SHOULD,Yes,No,No,No,"Providers SHOULD _partially mitigate, fully mitigate,_ or _remediate vulnerabilities_ to a lower _potential adverse impact_ within the timeframes from evaluation shown below (in days), factoring for the current _potential adverse impact_, _internet reachability,_ and _likely exploitability_:"
FRR-VDR-TF-LO-07,VDR,Mitigate During Operations,SHOULD,Yes,No,No,No,Providers SHOULD _mitigate_ or _remediate_ remaining _vulnerabilities_ during routine operations as determined necessary by the provider.
FRR-VDR-TF-MO-01,VDR,14-Day History,SHOULD,No,Yes,No,Partial,"Providers SHOULD make all recent historical _vulnerability detection_ and _response_ activity available in a _machine-readable_ format for automated retrieval by all necessary parties (e.g. using an API service or similar); this information SHOULD be updated _persistently_, at least once every 14 days."
FRR-VDR-TF-MO-02,VDR,3-Day Sampling,SHOULD,No,Yes,No,Partial,"Providers SHOULD _persistently_ perform _vulnerability detection_ on representative samples of similar _machine-based_ _information resources_, at least once every 3 days."
FRR-VDR-TF-MO-03,VDR,14-Day Drift Detection,SHOULD,No,Yes,No,Partial,"Providers SHOULD _persistently_ perform _vulnerability detection_ on all _information resources_ that are _likely_ to _drift_, at least once every 14 days."
FRR-VDR-TF-MO-04,VDR,Monthly Detection,SHOULD,No,Yes,No,Partial,"Providers SHOULD _persistently_ perform _vulnerability detection_ on all _information resources_ that are NOT _likely_ to _drift_, at least once per month."
FRR-VDR-TF-MO-05,VDR,Evaluate Within 5 Days,MUST,No,Yes,No,No,"Providers SHOULD evaluate ALL _vulnerabilities_ as required by FRR-VDR-07, FRR-VDR-08, and FRR-VDR-09 within 5 days of _detection_."
FRR-VDR-TF-MO-06,VDR,Incidents,SHOULD,No,Yes,No,No,Providers SHOULD treat _internet-reachable likely exploitable vulnerabilities_ with a _potential adverse impact_ of N4 or N5 as a security _incident_ until they are _partially mitigated_ to N3 or below.
FRR-VDR-TF-MO-07,VDR,Mitigate Per Timeframes,SHOULD,No,Yes,No,No,"Providers SHOULD _partially mitigate, fully mitigate,_ or _remediate vulnerabilities_ to a lower _potential adverse impact_ within the timeframes from evaluation shown below, factoring for the current _potential adverse impact_, _internet reachability,_ and _likely exploitability_:"
FRR-VDR-TF-MO-08,VDR,Mitigate During Operations,SHOULD,No,Yes,No,No,Providers SHOULD _mitigate_ or _remediate_ remaining _vulnerabilities_ during routine operations as determined necessary by the provider.
